{
  "project_name": "flashcard-app",
  "files": [
    {
      "path": "package.json",
      "contents": "{\n  \"name\": \"flashcard-app\",\n  \"version\": \"0.1.0\",\n  \"private\": true,\n  \"description\": \"Minimal Express server base for flash card app\",\n  \"scripts\": {\n    \"start\": \"node server.js\",\n    \"dev\": \"nodemon server.js\",\n    \"test\": \"jest --runInBand\"\n  },\n  \"dependencies\": {\n    \"express\": \"^4.19.2\"\n  },\n  \"devDependencies\": {\n    \"jest\": \"^29.7.0\",\n    \"supertest\": \"^6.3.4\",\n    \"nodemon\": \"^3.1.0\"\n  },\n  \"jest\": {\n    \"testEnvironment\": \"node\"\n  }\n}\n"
    },
    {
      "path": "server.js",
      "contents": "const app = require('./app');\n\nconst PORT = process.env.PORT || 7995;\n\napp.listen(PORT, () => {\n  console.log(`Server listening on http://localhost:${PORT}`);\n});\n"
    },
    {
      "path": "app.js",
      "contents": "const express = require('express');\nconst path = require('path');\n\nconst app = express();\n\n// Parse JSON bodies\napp.use(express.json());\n\n// Serve static files from public/\nconst publicDir = path.join(__dirname, 'public');\napp.use(express.static(publicDir));\n\n// Health check endpoint\napp.get('/health', (_req, res) => {\n  res.status(200).json({ status: 'ok' });\n});\n\nmodule.exports = app;\n"
    },
    {
      "path": "public/index.html",
      "contents": "<!doctype html>\n<html lang=\"en\">\n<head>\n  <meta charset=\"utf-8\" />\n  <meta name=\"viewport\" content=\"width=device-width, initial-scale=1\" />\n  <title>Flashcard App</title>\n  <meta name=\"color-scheme\" content=\"light\" />\n  <script src=\"https://cdn.tailwindcss.com\"></script>\n</head>\n<body class=\"min-h-screen bg-white text-black\">\n  <div class=\"max-w-2xl mx-auto p-4\">\n    <header class=\"mb-6\">\n      <h1 class=\"text-3xl font-bold tracking-tight border-b border-black pb-2\">Flashcard App</h1>\n      <p class=\"text-sm text-red-600 mt-2\">Minimal red, black, and white interface.</p>\n    </header>\n\n    <main class=\"space-y-4\">\n      <section class=\"p-4 border border-black rounded\">\n        <h2 class=\"text-xl font-semibold mb-2\">Current Card</h2>\n        <div id=\"card\" class=\"p-4 border border-black rounded bg-white\">\n          <p class=\"text-black\" id=\"card-front\">No cards yet.</p>\n        </div>\n        <div class=\"mt-3 flex items-center gap-2\">\n          <button id=\"prevBtn\" class=\"px-3 py-1 border border-black rounded bg-white text-black\">Prev</button>\n          <button id=\"nextBtn\" class=\"px-3 py-1 border border-black rounded bg-white text-black\">Next</button>\n          <button id=\"flipBtn\" class=\"ml-auto px-3 py-1 rounded bg-red-600 text-white\">Flip</button>\n        </div>\n      </section>\n\n      <section class=\"p-4 border border-black rounded\">\n        <h2 class=\"text-xl font-semibold mb-2\">Add Card</h2>\n        <form id=\"addForm\" class=\"space-y-2\">\n          <input type=\"text\" id=\"frontInput\" class=\"w-full p-2 border border-black bg-white text-black\" placeholder=\"Front text\" />\n          <input type=\"text\" id=\"backInput\" class=\"w-full p-2 border border-black bg-white text-black\" placeholder=\"Back text\" />\n          <div class=\"flex gap-2\">\n            <button type=\"submit\" class=\"px-3 py-1 rounded bg-red-600 text-white\">Add</button>\n            <button type=\"reset\" class=\"px-3 py-1 border border-black bg-white text-black rounded\">Clear</button>\n          </div>\n        </form>\n      </section>\n    </main>\n\n    <footer class=\"mt-8 text-center text-xs text-black border-t border-black pt-4\">\n      <span class=\"text-black\">&copy; 2025 Flashcard App</span>\n    </footer>\n  </div>\n\n  <script src=\"./app.js\"></script>\n</body>\n</html>\n"
    },
    {
      "path": "public/app.js",
      "contents": "document.addEventListener('DOMContentLoaded', () => {\n  const form = document.getElementById('addForm');\n  const cardFront = document.getElementById('card-front');\n  const frontInput = document.getElementById('frontInput');\n  const backInput = document.getElementById('backInput');\n\n  if (form) {\n    form.addEventListener('submit', (e) => {\n      e.preventDefault();\n      const front = (frontInput && frontInput.value ? frontInput.value : '').trim();\n      const back = (backInput && backInput.value ? backInput.value : '').trim();\n      if (!front || !back) return;\n      if (cardFront) cardFront.textContent = front;\n      form.reset();\n    });\n  }\n\n  const flipBtn = document.getElementById('flipBtn');\n  if (flipBtn) {\n    flipBtn.addEventListener('click', () => {\n      if (!cardFront) return;\n      cardFront.textContent = cardFront.textContent === 'Back' ? 'Front' : 'Back';\n    });\n  }\n});\n"
    },
    {
      "path": "tests/server.test.js",
      "contents": "const request = require('supertest');\nconst app = require('../app');\n\ndescribe('Express base server and frontend', () => {\n  it('GET /health returns 200 with {status:\"ok\"}', async () => {\n    const res = await request(app).get('/health');\n    expect(res.status).toBe(200);\n    expect(res.body).toEqual({ status: 'ok' });\n  });\n\n  it('serves public/index.html at / with Tailwind Play CDN present', async () => {\n    const res = await request(app).get('/');\n    expect(res.status).toBe(200);\n    expect(res.text).toMatch(/Flashcard\\s+App/i);\n    expect(res.text).toMatch(/cdn\\.tailwindcss\\.com/);\n  });\n\n  it('serves public/app.js', async () => {\n    const res = await request(app).get('/app.js');\n    expect(res.status).toBe(200);\n    expect(res.type).toMatch(/javascript/);\n  });\n});\n"
    },
    {
      "path": "README.md",
      "contents": "# Flashcard App\n\nMinimal Express app serving a simple frontend styled with Tailwind CSS (via Play CDN). Colors are limited to red, black, and white.\n\n- Framework: Express\n- Port: 7995\n- Styling: Tailwind CSS (Play CDN)\n\n## Run\n\n1. Install dependencies:\n   npm install\n\n2. Start the server:\n   npm run dev\n\n3. Open the app in your browser:\n   http://localhost:7995\n\n## Test\n\nRun tests with:\n\nnpm test\n"
    }
  ],
  "notes": [
    "Open http://localhost:7995 to view the Tailwind-styled index page.",
    "Tailwind is included via the Play CDN and only red, black, and white utility classes are used."
  ],
  "hasTests": true
}