{
  "project_name": "add-numbers-lib",
  "files": [
    {
      "path": "package.json",
      "contents": "{\n  \"name\": \"add-numbers-lib\",\n  \"version\": \"0.1.0\",\n  \"description\": \"Small TypeScript library with one function addNumbers and unit tests\",\n  \"main\": \"dist/index.js\",\n  \"types\": \"dist/index.d.ts\",\n  \"scripts\": {\n    \"build\": \"tsc\",\n    \"test\": \"jest\",\n    \"prepare\": \"npm run build\"\n  },\n  \"author\": \"\",\n  \"license\": \"MIT\",\n  \"devDependencies\": {\n    \"@types/jest\": \"^29.5.2\",\n    \"jest\": \"^29.6.1\",\n    \"ts-jest\": \"^29.1.0\",\n    \"typescript\": \"^5.2.2\"\n  }\n}\n"
    },
    {
      "path": "tsconfig.json",
      "contents": "{\n  \"compilerOptions\": {\n    \"target\": \"ES2019\",\n    \"module\": \"CommonJS\",\n    \"declaration\": true,\n    \"outDir\": \"dist\",\n    \"rootDir\": \"src\",\n    \"strict\": true,\n    \"esModuleInterop\": true,\n    \"skipLibCheck\": true\n  },\n  \"include\": [\"src/**/*\"],\n  \"exclude\": [\"node_modules\", \"dist\", \"tests\"]\n}\n"
    },
    {
      "path": "jest.config.js",
      "contents": "module.exports = {\n  preset: 'ts-jest',\n  testEnvironment: 'node',\n  testMatch: ['**/tests/**/*.test.ts']\n};\n"
    },
    {
      "path": "src/add.ts",
      "contents": "export function addNumbers(a: number, b: number): number {\n  // Validate inputs are finite numbers\n  if (!Number.isFinite(a) || !Number.isFinite(b)) {\n    throw new TypeError('addNumbers: both arguments must be finite numbers');\n  }\n\n  // Guard against unsafe integer inputs that might cause precision loss\n  const max = Number.MAX_SAFE_INTEGER;\n  if (Math.abs(a) > max || Math.abs(b) > max) {\n    throw new RangeError('addNumbers: input magnitude exceeds Number.MAX_SAFE_INTEGER');\n  }\n\n  return a + b;\n}\n"
    },
    {
      "path": "src/index.ts",
      "contents": "export { addNumbers } from './add';\n"
    },
    {
      "path": "tests/add.test.ts",
      "contents": "import { addNumbers } from '../src';\n\ndescribe('addNumbers', () => {\n  test('adds two positive numbers', () => {\n    expect(addNumbers(2, 3)).toBe(5);\n  });\n\n  test('adds negative and positive number', () => {\n    expect(addNumbers(-2, 5)).toBe(3);\n  });\n\n  test('throws on NaN input', () => {\n    expect(() => addNumbers(NaN, 1)).toThrow(TypeError);\n  });\n\n  test('throws on Infinity input', () => {\n    expect(() => addNumbers(Infinity, 1)).toThrow(TypeError);\n  });\n\n  test('throws when inputs exceed Number.MAX_SAFE_INTEGER', () => {\n    expect(() => addNumbers(Number.MAX_SAFE_INTEGER + 1, 1)).toThrow(RangeError);\n  });\n});\n"
    },
    {
      "path": "README.md",
      "contents": "# add-numbers-lib\n\nSmall TypeScript library exposing a single function addNumbers(a, b).\n\nSetup and test:\n\n1. Install dependencies\n\n   npm install\n\n2. Run tests\n\n   npm test\n\n3. Build (optional)\n\n   npm run build\n\n"
    },
    {
      "path": "SPEC.md",
      "contents": "# Function Specification: addNumbers\n\nPurpose\n\nThis small library provides one well-documented utility function, addNumbers, for reliably adding two numeric values in JavaScript/TypeScript while validating inputs and guarding against common numeric edge cases.\n\nFunction Name\n\n- addNumbers\n\nSignature\n\n- TypeScript: function addNumbers(a: number, b: number): number\n\nParameters\n\n- a (number): The first addend. Must be a finite number (not NaN, not Infinity) and within Number.MAX_SAFE_INTEGER magnitude.\n- b (number): The second addend. Same validation rules as parameter `a`.\n\nReturn Value\n\n- Returns the numeric sum a + b as a number.\n\nErrors / Exceptions\n\n- Throws TypeError if either input is not a finite number (e.g., NaN, Infinity, -Infinity, or non-number values when TypeScript's type system is bypassed at runtime).\n- Throws RangeError if either input's absolute value exceeds Number.MAX_SAFE_INTEGER to avoid silent precision loss for very large integers.\n\nBehavior Notes\n\n- The function performs runtime validation even though TypeScript types are used. This guards against runtime misuse from plain JavaScript callers or type assertions.\n- The function does not accept numeric strings or other coercible types; callers should convert to number before calling.\n- The function returns the exact JavaScript numeric sum when inputs are valid. For non-integer floating-point values, normal IEEE-754 rounding applies.\n\nEdge Cases (at least three)\n\n1. Non-finite inputs: addNumbers(NaN, 1) or addNumbers(Infinity, 1)\n   - Expected: throw TypeError.\n\n2. Very large integers near or beyond safe integer limits: addNumbers(Number.MAX_SAFE_INTEGER + 1, 1)\n   - Expected: throw RangeError to avoid returning a silently incorrect result due to precision loss.\n\n3. Mixed sign zeros: addNumbers(+0, -0)\n   - Expected: returns 0 (JavaScript treats +0 and -0 as equal; function returns the standard numeric result).\n\n4. Floating-point rounding: addNumbers(0.1, 0.2)\n   - Expected: returns a result consistent with IEEE-754 (approximately 0.30000000000000004). The function does not attempt to compensate for floating-point rounding.\n\nExamples\n\n- addNumbers(2, 3) -> 5\n- addNumbers(-1.5, 2.5) -> 1.0\n- addNumbers(Number.MAX_SAFE_INTEGER, 0) -> Number.MAX_SAFE_INTEGER\n\nImplementation Note\n\n- The implementation validates inputs with Number.isFinite and compares magnitudes against Number.MAX_SAFE_INTEGER. It then returns the sum using normal JavaScript addition.\n\n"
    }
  ],
  "notes": [
    "Run `npm install` to install dev dependencies, then `npm test` to run the tests.",
    "The SPEC.md file contains the requested one-page specification for the addNumbers function."
  ],
  "hasTests": true
}