{
  "project_name": "hello-rainbow-ui-req",
  "files": [
    {
      "path": "package.json",
      "contents": "{\n  \"name\": \"hello-rainbow-ui-req\",\n  \"version\": \"0.1.0\",\n  \"private\": true,\n  \"description\": \"Requirements doc and tests for a Hello World rainbow UI\",\n  \"scripts\": {\n    \"test\": \"jest\"\n  },\n  \"devDependencies\": {\n    \"@types/jest\": \"^29.5.3\",\n    \"jest\": \"^29.6.0\",\n    \"ts-jest\": \"^29.1.0\",\n    \"typescript\": \"^5.2.2\"\n  }\n}\n"
    },
    {
      "path": "tsconfig.json",
      "contents": "{\n  \"compilerOptions\": {\n    \"target\": \"ES2019\",\n    \"module\": \"commonjs\",\n    \"strict\": true,\n    \"esModuleInterop\": true,\n    \"forceConsistentCasingInFileNames\": true,\n    \"skipLibCheck\": true,\n    \"outDir\": \"dist\",\n    \"rootDir\": \"src\"\n  },\n  \"include\": [\"src\", \"tests\"]\n}\n"
    },
    {
      "path": "jest.config.cjs",
      "contents": "module.exports = {\n  preset: 'ts-jest',\n  testEnvironment: 'node',\n  testMatch: ['**/tests/**/*.test.ts']\n};\n"
    },
    {
      "path": "README.md",
      "contents": "# Hello Rainbow UI — Requirements Subtask\n\nThis repository holds the one-page requirements document for a UI that displays a \"Hello World\" message with rainbow styling and animations, plus automated checks that verify the requirements document contains the expected sections and key terms.\n\nRun steps:\n\n1. Install dependencies:\n\n   npm install\n\n2. Run tests (validates the requirements document):\n\n   npm test\n\nWhat this subtask provides:\n\n- docs/requirements.md — the one-page functional & visual requirements (the primary artifact for this subtask).\n- tests/requirements.test.ts — automated tests that assert the requirements file includes required items.\n\nNotes:\n- This is a documentation subtask; no UI implementation is included yet.\n"
    },
    {
      "path": "docs/requirements.md",
      "contents": "# Hello World - Rainbow UI Requirements\n\nVersion: 0.1.0\nLast updated: 2025-10-11\nAuthor: UI Team — Requirements Subtask\n\nOverview\n\nThis document describes the exact functional and visual requirements for a single-page UI that displays a \"Hello World\" message with rainbow styling and subtle animations. It defines what the user should see and how the interface should behave across target platforms, plus accessibility expectations and acceptance criteria.\n\n1. Primary text content\n\n- Visible text: \"Hello World\"\n- Exact capitalization and spacing: capital \"H\" and \"W\", one space between words: Hello World\n- A short accessible label for screen readers should be present and match the visible text unless an enhanced description is provided.\n\n2. Target platforms and environments\n\n- Primary target: modern web browsers (desktop and mobile) built with standard HTML/CSS/JS.\n- Supported viewport widths: responsive from 320px (small phones) to 1920px (large desktops).\n- The UI must be usable on both touch and pointer devices.\n- No reliance on browser-specific proprietary APIs.\n\n3. Visual design\n\n- Layout: a single centered message on the page. Both vertical and horizontal centering within the viewport.\n- Typography: use a legible sans-serif system stack (e.g., system-ui, -apple-system, \"Segoe UI\", Roboto, \"Helvetica Neue\", Arial).\n- Font size examples (fluid/responsive): base font-size 32px on desktop, scale down appropriately on small screens (minimum readable size: 18px).\n\n4. Color and rainbow styling\n\n- The message text must display a visually continuous rainbow across the characters or as an animated gradient applied to the text fill.\n- Use the following representative rainbow stops (hex):\n  - Red: #FF0000\n  - Orange: #FF7F00\n  - Yellow: #FFFF00\n  - Green: #00FF00\n  - Blue: #0000FF\n  - Indigo: #4B0082\n  - Violet: #8B00FF\n\n- Visual intent: the rainbow should be vivid but maintain accessible contrast against the background.\n- Background: neutral solid color, default white (#FFFFFF) or very light gray to maintain contrast.\n\n5. Animations\n\n- Entrance: Fade-in on page load for the whole message (duration: nominal 400ms to 600ms).\n- Rainbow animation: subtle continuous movement of the rainbow gradient across the text (e.g., slow horizontal gradient shift or hue rotation). Movement should be gentle (one full cycle no faster than 8s and no faster than once every 4s for smaller animations) and loop infinitely.\n- Motion alternatives: Respect the user's operating system/agent preference for reduced motion (prefers-reduced-motion). When prefers-reduced-motion is set, all non-essential motion must be disabled — provide a static rainbow or solid-color fallback with no animation.\n\n6. Interaction and states\n\n- No complex interactive controls are required for this page; the message is informational.\n- Keyboard focus: Ensure any focusable elements on the page (if present, e.g., a skip link) follow visible focus outlines that meet accessibility contrast.\n\n7. Accessibility\n\n- Semantic HTML: the greeting should be in a heading element (e.g., <h1>) for significance and screen reader discovery.\n- ARIA: avoid unnecessary ARIA; if an alternate description exists, it should be exposed via aria-describedby rather than overriding the text.\n- Contrast: ensure text (or its visual effect) meets at least AA contrast against the background. If gradient text causes contrast evaluation difficulties, provide a solid high-contrast fallback (e.g., black #000000) when needed.\n- Reduced motion: honor prefers-reduced-motion and provide clear, non-animated equivalents.\n- Screen reader: the message must be readable by assistive tech; do not rely solely on images to convey the text.\n\n8. Performance and responsiveness\n\n- The UI should load quickly; animations must be implemented using CSS transforms or opacity where possible to avoid layout thrashing.\n- No large assets required.\n\n9. Implementation notes (non-normative)\n\n- Implement gradient text using background-clip: text and animated background-position or CSS variables/hue-rotate filters.\n- Use prefers-reduced-motion media query to disable animations.\n\n10. Success criteria (acceptance tests)\n\nA. Visual correctness\n   - The page displays the text \"Hello World\" centered in the viewport.\n   - The text shows rainbow styling using the provided color stops or a visually equivalent rainbow gradient.\n   - Entrance fade and gentle rainbow animation are present by default.\n\nB. Accessibility\n   - The text is in a semantic heading element (<h1>) and is discoverable by screen readers.\n   - When the system or user agent reports prefers-reduced-motion, no non-essential animations run.\n   - Text has an accessible fallback color that meets contrast requirements when the gradient alone does not.\n\nC. Platform & responsiveness\n   - The layout scales and remains legible between 320px and 1920px viewports.\n\nD. Testability\n   - An automated test verifies the requirements document contains the following explicit items: the exact visible text \"Hello World\", the words \"prefers-reduced-motion\", at least one of the rainbow hex colors listed above (e.g., #FF0000), and a success criteria section describing acceptance tests.\n\n11. Deliverables for implementation task\n\n- One-page UI (HTML/CSS/JS) implementing the above visual behavior.\n- A11y checks and a short demo page for manual review.\n\nEnd of requirements.\n"
    },
    {
      "path": "src/index.ts",
      "contents": "// Placeholder module for the requirements subtask.\n// No UI implementation is included in this subtask.\nexport const requirementsPath = 'docs/requirements.md';\n"
    },
    {
      "path": "tests/requirements.test.ts",
      "contents": "import { readFileSync } from 'fs';\nimport { join } from 'path';\n\ndescribe('requirements document', () => {\n  const path = join(__dirname, '..', 'docs', 'requirements.md');\n  let contents: string;\n\n  beforeAll(() => {\n    contents = readFileSync(path, 'utf8');\n  });\n\n  test('contains the exact visible text Hello World', () => {\n    expect(contents).toMatch(/Hello World/);\n  });\n\n  test('mentions prefers-reduced-motion', () => {\n    expect(contents.toLowerCase()).toContain('prefers-reduced-motion');\n  });\n\n  test('includes at least one rainbow hex color (e.g., #FF0000)', () => {\n    const hexPattern = /#([A-Fa-f0-9]{6})/g;\n    const matches = contents.match(hexPattern) || [];\n    expect(matches.length).toBeGreaterThanOrEqual(1);\n  });\n\n  test('contains a success criteria section mentioning acceptance tests', () => {\n    expect(contents).toMatch(/Success criteria/i);\n    expect(contents).toMatch(/acceptance tests?/i);\n  });\n});\n"
    }
  ],
  "notes": [
    "Run `npm install` then `npm test` to validate the requirements document.",
    "This subtask provides a single requirements page (docs/requirements.md) plus tests that assert the document contains required sections and keywords."
  ],
  "hasTests": true
}