{
  "project_name": "lab-tech-landing",
  "files": [
    {
      "path": "package.json",
      "contents": "{\n  \"name\": \"lab-tech-landing\",\n  \"version\": \"1.0.0\",\n  \"private\": true,\n  \"description\": \"Minimal production-ready landing page for a lab technician using Express, plain HTML/CSS/JS.\",\n  \"main\": \"server.js\",\n  \"scripts\": {\n    \"start\": \"node server.js\",\n    \"dev\": \"nodemon server.js\",\n    \"test\": \"jest\"\n  },\n  \"dependencies\": {\n    \"express\": \"^4.18.2\"\n  },\n  \"devDependencies\": {\n    \"jest\": \"^29.7.0\",\n    \"supertest\": \"^6.3.3\",\n    \"jsdom\": \"^22.1.0\",\n    \"nodemon\": \"^3.0.1\"\n  }\n}\n"
    },
    {
      "path": "server.js",
      "contents": "const path = require('path');\nconst express = require('express');\n\nconst app = express();\n\nconst publicDir = path.join(__dirname, 'public');\n\n// Serve static assets from /public with basic caching rules\napp.use(\n  express.static(publicDir, {\n    extensions: ['html'],\n    maxAge: '1h',\n    setHeaders: (res, filePath) => {\n      if (path.extname(filePath) === '.html') {\n        res.setHeader('Cache-Control', 'no-cache');\n      }\n    }\n  })\n);\n\n// Health endpoint for uptime checks and tests\napp.get('/health', (req, res) => {\n  res.status(200).json({ status: 'ok' });\n});\n\n// Fallback to index.html for any other GET route (SPA behavior)\napp.get('*', (req, res, next) => {\n  if (req.path === '/health') return next();\n  res.sendFile(path.join(publicDir, 'index.html'), (err) => {\n    if (err) next(err);\n  });\n});\n\n// Basic error logging/handling\n// eslint-disable-next-line no-unused-vars\napp.use((err, req, res, next) => {\n  // Basic error logging\n  // eslint-disable-next-line no-console\n  console.error('Server error:', err && err.stack ? err.stack : err);\n  if (!res.headersSent) {\n    res.status(500).json({ error: 'Internal Server Error' });\n  }\n});\n\nconst PORT = process.env.PORT ? parseInt(process.env.PORT, 10) : 3000;\n\n// Start the server only when run directly\nif (require.main === module) {\n  app\n    .listen(PORT, () => {\n      // eslint-disable-next-line no-console\n      console.log(`Server listening on http://localhost:${PORT}`);\n    })\n    .on('error', (err) => {\n      // eslint-disable-next-line no-console\n      console.error('Failed to start server:', err);\n      process.exitCode = 1;\n    });\n}\n\nmodule.exports = app;\n"
    },
    {
      "path": "public/index.html",
      "contents": "<!doctype html>\n<html lang=\"en\">\n  <head>\n    <meta charset=\"utf-8\" />\n    <meta name=\"viewport\" content=\"width=device-width, initial-scale=1\" />\n    <title>Lab Technician - Landing</title>\n    <link rel=\"stylesheet\" href=\"/styles.css\" />\n  </head>\n  <body>\n    <header class=\"hero\">\n      <h1 id=\"hero-title\">Lab Technician</h1>\n      <p class=\"subtitle\">Precision. Safety. Results.</p>\n    </header>\n\n    <script src=\"/app.js\" defer></script>\n  </body>\n</html>\n"
    },
    {
      "path": "public/styles.css",
      "contents": ":root {\n  --red: #d32f2f;\n  --black: #000000;\n  --white: #ffffff;\n}\n\n* { box-sizing: border-box; }\n\nhtml, body {\n  margin: 0;\n  padding: 0;\n}\n\nbody {\n  font-family: system-ui, -apple-system, Segoe UI, Roboto, Helvetica, Arial, sans-serif, \"Apple Color Emoji\", \"Segoe UI Emoji\";\n  background: var(--white);\n  color: var(--black);\n  line-height: 1.5;\n}\n\n.hero {\n  padding: 4rem 1rem;\n  text-align: center;\n  background: var(--black);\n  color: var(--white);\n}\n\n.hero #hero-title {\n  margin: 0 0 0.5rem 0;\n  font-size: clamp(2rem, 5vw, 3rem);\n}\n\n.hero .subtitle {\n  margin: 0;\n  color: var(--red);\n  font-weight: 500;\n}\n\na { color: var(--red); }\n"
    },
    {
      "path": "public/app.js",
      "contents": "document.addEventListener('DOMContentLoaded', () => {\n  // Placeholder for client-side interactions (validation will be added later)\n  // Keeping palette strictly red/black/white is handled in CSS.\n  // This log is useful during dev and harmless in production.\n  // eslint-disable-next-line no-console\n  console.log('App initialized');\n});\n"
    },
    {
      "path": "tests/health.test.js",
      "contents": "const request = require('supertest');\nconst app = require('../server');\n\ndescribe('Health endpoint', () => {\n  it('GET /health returns 200 and {status:\"ok\"}', async () => {\n    const res = await request(app)\n      .get('/health')\n      .expect(200)\n      .expect('Content-Type', /json/);\n    expect(res.body).toEqual({ status: 'ok' });\n  });\n});\n"
    },
    {
      "path": "tests/hero.test.js",
      "contents": "const fs = require('fs');\nconst path = require('path');\nconst { JSDOM } = require('jsdom');\n\ndescribe('Hero title in index.html', () => {\n  it('contains an element with id=\"hero-title\" and expected text', () => {\n    const html = fs.readFileSync(path.join(__dirname, '..', 'public', 'index.html'), 'utf8');\n    const dom = new JSDOM(html);\n    const doc = dom.window.document;\n    const el = doc.getElementById('hero-title');\n    expect(el).toBeTruthy();\n    expect(el.textContent.trim()).toBe('Lab Technician');\n  });\n});\n"
    },
    {
      "path": "README.md",
      "contents": "# Lab Technician Landing Page\n\nA minimal, production-ready landing page for a lab technician. Single HTML page served by Express with a health endpoint, plain CSS/JS, and automated tests.\n\n## Prerequisites\n- Node.js >= 16\n\n## Install\n- npm install\n\n## Run\n- PORT=3000 npm start\n  - Defaults to port 3000 if PORT is not set.\n  - Visit http://localhost:3000\n\n## Development\n- npm run dev\n  - Uses nodemon to reload on changes.\n\n## Test\n- npm test\n  - Verifies the hero title exists in index.html and /health returns {\"status\":\"ok\"}.\n\n## Project Structure\n- server.js: Express server (static host + /health + SPA fallback)\n- public/: Static assets (index.html, styles.css, app.js)\n- tests/: Jest tests\n"
    }
  ],
  "notes": [
    "Run the server with npm start. Optionally set PORT to override the default 3000.",
    "Tests can be run with npm test."
  ],
  "hasTests": true
}