{
  "project_name": "express-tailwind-app",
  "files": [
    {
      "path": "package.json",
      "contents": "{\n  \"name\": \"express-tailwind-app\",\n  \"version\": \"0.1.0\",\n  \"private\": true,\n  \"scripts\": {\n    \"build\": \"tsc -p tsconfig.json && npm run build:css\",\n    \"build:css\": \"tailwindcss -c tailwind.config.js -i src/styles/input.css -o public/styles.css --minify\",\n    \"start\": \"npm run build && node dist/server.js\",\n    \"test\": \"npm run build && mocha \\\"tests/**/*.test.js\\\"\"\n  },\n  \"dependencies\": {\n    \"express\": \"^4.19.2\"\n  },\n  \"devDependencies\": {\n    \"@types/express\": \"^4.17.21\",\n    \"@types/node\": \"^20.11.30\",\n    \"autoprefixer\": \"^10.4.19\",\n    \"chai\": \"^4.3.10\",\n    \"mocha\": \"^10.4.0\",\n    \"postcss\": \"^8.4.38\",\n    \"supertest\": \"^6.3.3\",\n    \"tailwindcss\": \"^3.4.10\",\n    \"typescript\": \"^5.4.3\"\n  }\n}\n"
    },
    {
      "path": "tsconfig.json",
      "contents": "{\n  \"compilerOptions\": {\n    \"target\": \"ES2020\",\n    \"module\": \"CommonJS\",\n    \"lib\": [\"ES2020\"],\n    \"outDir\": \"dist\",\n    \"rootDir\": \"src\",\n    \"strict\": true,\n    \"esModuleInterop\": true,\n    \"forceConsistentCasingInFileNames\": true,\n    \"skipLibCheck\": true\n  },\n  \"include\": [\"src/**/*\"]\n}\n"
    },
    {
      "path": "src/app.ts",
      "contents": "import express from 'express';\nimport path from 'path';\n\nconst app = express();\n\n// Serve static assets from the public directory\nconst publicDir = path.join(__dirname, '..', 'public');\napp.use(express.static(publicDir));\n\n// Explicitly serve index.html at root\napp.get('/', (_req, res) => {\n  res.sendFile(path.join(publicDir, 'index.html'));\n});\n\nexport default app;\n"
    },
    {
      "path": "src/server.ts",
      "contents": "import app from './app';\n\nconst PORT = Number(process.env.PORT) || 3000;\n\napp.listen(PORT, () => {\n  console.log(`Server listening on http://localhost:${PORT}`);\n});\n"
    },
    {
      "path": "public/index.html",
      "contents": "<!doctype html>\n<html lang=\"en\">\n  <head>\n    <meta charset=\"UTF-8\" />\n    <meta name=\"viewport\" content=\"width=device-width, initial-scale=1.0\" />\n    <title>Hello World App</title>\n    <link rel=\"stylesheet\" href=\"/styles.css\" />\n  </head>\n  <body class=\"body-bg\">\n    <main class=\"app-container\">\n      <h1 id=\"title\" class=\"app-title\">Hello World</h1>\n      <p class=\"mt-4 text-gray-700\">Tailwind CSS is built via PostCSS and served locally.</p>\n    </main>\n  </body>\n</html>\n"
    },
    {
      "path": "tailwind.config.js",
      "contents": "/** @type {import('tailwindcss').Config} */\nmodule.exports = {\n  content: [\n    './public/**/*.html',\n    './src/**/*.{ts,js}'\n  ],\n  theme: {\n    extend: {}\n  },\n  plugins: []\n};\n"
    },
    {
      "path": "postcss.config.js",
      "contents": "module.exports = {\n  plugins: {\n    tailwindcss: {},\n    autoprefixer: {}\n  }\n};\n"
    },
    {
      "path": "src/styles/input.css",
      "contents": "@tailwind base;\n@tailwind components;\n@tailwind utilities;\n\n/* Custom styles to verify Tailwind build output and apply app styling */\n.app-title { @apply text-4xl font-bold text-blue-600; }\n.app-container { @apply text-center p-6 bg-white rounded-lg shadow; }\n.body-bg { @apply min-h-screen bg-gray-100 flex items-center justify-center; }\n"
    },
    {
      "path": "tests/app.test.js",
      "contents": "const request = require('supertest');\nconst { expect } = require('chai');\nconst app = require('../dist/app').default;\n\ndescribe('Express Tailwind App', function () {\n  it('serves index.html with link to built styles.css', async function () {\n    const res = await request(app).get('/');\n    expect(res.status).to.equal(200);\n    expect(res.text).to.include('Hello World');\n    expect(res.text).to.match(/<link[^>]+href=[\"']\\/styles\\.css[\"']/);\n  });\n\n  it('serves built Tailwind CSS at /styles.css', async function () {\n    const res = await request(app).get('/styles.css');\n    expect(res.status).to.equal(200);\n    expect(res.type).to.include('css');\n    expect(res.text).to.include('.app-title');\n  });\n});\n"
    },
    {
      "path": "README.md",
      "contents": "# Express + Tailwind CSS (PostCSS build)\n\n## Setup\n- Node.js 18+ recommended\n\n```sh\nnpm install\n```\n\n## Build\n- Compiles TypeScript and builds Tailwind to public/styles.css\n```sh\nnpm run build\n```\n\n## Run\n```sh\nnpm start\n```\nVisit http://localhost:3000 and you should see the styled Hello World page.\n\n## Tests\n- Ensures the server serves the page and the built CSS\n```sh\nnpm test\n```\n\n## How it works\n- Tailwind input: src/styles/input.css\n- Tailwind config: tailwind.config.js\n- PostCSS config: postcss.config.js\n- Built CSS output: public/styles.css (generated by npm run build)\n- Express serves static files from public/\n"
    }
  ],
  "notes": [
    "Run npm run build to generate public/styles.css via Tailwind before starting the server. npm start and npm test already run the build step."
  ],
  "hasTests": true
}