{
  "project_name": "express-tailwind-hello",
  "files": [
    {
      "path": "package.json",
      "contents": "{\n  \"name\": \"express-tailwind-hello\",\n  \"version\": \"0.1.0\",\n  \"private\": true,\n  \"type\": \"commonjs\",\n  \"scripts\": {\n    \"dev\": \"nodemon\",\n    \"build\": \"tsc\",\n    \"build:css\": \"tailwindcss -i ./src/input.css -o ./public/styles.css --minify\",\n    \"start\": \"node dist/index.js\",\n    \"start:js\": \"node server.js\",\n    \"test\": \"vitest run\"\n  },\n  \"dependencies\": {\n    \"express\": \"^4.19.2\"\n  },\n  \"devDependencies\": {\n    \"@types/express\": \"^4.17.21\",\n    \"@types/node\": \"^20.11.30\",\n    \"@types/supertest\": \"^2.0.16\",\n    \"autoprefixer\": \"^10.4.19\",\n    \"nodemon\": \"^3.0.1\",\n    \"postcss\": \"^8.4.38\",\n    \"supertest\": \"^6.3.3\",\n    \"tailwindcss\": \"^3.4.4\",\n    \"ts-node\": \"^10.9.2\",\n    \"typescript\": \"^5.4.5\",\n    \"vitest\": \"^1.5.0\"\n  }\n}\n"
    },
    {
      "path": "tsconfig.json",
      "contents": "{\n  \"compilerOptions\": {\n    \"target\": \"ES2020\",\n    \"module\": \"CommonJS\",\n    \"rootDir\": \"src\",\n    \"outDir\": \"dist\",\n    \"strict\": true,\n    \"esModuleInterop\": true,\n    \"forceConsistentCasingInFileNames\": true,\n    \"skipLibCheck\": true\n  },\n  \"include\": [\"src/**/*.ts\", \"tests/**/*.ts\"]\n}\n"
    },
    {
      "path": "nodemon.json",
      "contents": "{\n  \"watch\": [\"src\"],\n  \"ext\": \"ts\",\n  \"exec\": \"ts-node src/index.ts\"\n}\n"
    },
    {
      "path": "tailwind.config.js",
      "contents": "module.exports = {\n  content: [\"./public/**/*.html\", \"./src/**/*.{ts,js,tsx,jsx}\"],\n  theme: {\n    extend: {}\n  },\n  plugins: [],\n  safelist: [\n    \"text-red-500\",\n    \"text-blue-500\",\n    \"text-green-500\",\n    \"bg-red-500\",\n    \"bg-blue-500\",\n    \"bg-green-500\"\n  ]\n};\n"
    },
    {
      "path": "postcss.config.js",
      "contents": "module.exports = {\n  plugins: {\n    tailwindcss: {},\n    autoprefixer: {}\n  }\n};\n"
    },
    {
      "path": "src/app.ts",
      "contents": "import express from 'express';\nimport path from 'path';\n\nexport const app = express();\n\n// Resolve public directory from project root so it works in dev, tests, and production\nconst publicDir = path.resolve(process.cwd(), 'public');\n\n// Serve static assets from the public directory\napp.use(express.static(publicDir));\n\n// Root route should serve the index.html in /public\napp.get('/', (_req, res) => {\n  res.sendFile(path.join(publicDir, 'index.html'));\n});\n\nexport default app;\n"
    },
    {
      "path": "src/index.ts",
      "contents": "import { app } from './app';\n\nconst PORT = Number(process.env.PORT) || 3000;\n\napp.listen(PORT, () => {\n  console.log(`Server listening on http://localhost:${PORT}`);\n});\n"
    },
    {
      "path": "src/input.css",
      "contents": "@tailwind base;\n@tailwind components;\n@tailwind utilities;\n"
    },
    {
      "path": "server.js",
      "contents": "const express = require('express');\nconst path = require('path');\n\nconst app = express();\nconst PORT = Number(process.env.PORT) || 3000;\n\nconst publicDir = path.join(__dirname, 'public');\n\napp.use(express.static(publicDir));\n\napp.get('/', (_req, res) => {\n  res.sendFile(path.join(publicDir, 'index.html'));\n});\n\napp.listen(PORT, () => {\n  console.log(`Server listening on http://localhost:${PORT}`);\n});\n"
    },
    {
      "path": "public/index.html",
      "contents": "<!doctype html>\n<html lang=\"en\">\n  <head>\n    <meta charset=\"utf-8\" />\n    <meta name=\"viewport\" content=\"width=device-width, initial-scale=1\" />\n    <title>Hello World - Express + Tailwind</title>\n    <link rel=\"stylesheet\" href=\"/styles.css\" />\n  </head>\n  <body class=\"min-h-screen bg-gray-50 text-gray-900\">\n    <main class=\"container mx-auto p-6\">\n      <h1 id=\"hello-text\" class=\"text-3xl font-bold\">Hello World</h1>\n      <p class=\"mt-4 text-sm text-gray-600\">Static assets are being served from /public.</p>\n    </main>\n  </body>\n</html>\n"
    },
    {
      "path": "public/styles.css",
      "contents": "/* This file will be (re)generated by `npm run build:css`. */\n/* Minimal placeholder so static serving works out-of-the-box. */\n:root{}\n"
    },
    {
      "path": "tests/app.test.ts",
      "contents": "import request from 'supertest';\nimport { describe, it, expect } from 'vitest';\nimport { app } from '../src/app';\n\ndescribe('Express static serving and root route', () => {\n  it('GET / should serve index.html', async () => {\n    const res = await request(app).get('/');\n    expect(res.status).toBe(200);\n    expect(res.type).toMatch(/html/);\n    expect(res.text).toMatch(/Hello World/);\n  });\n\n  it('serves static assets from /public (styles.css)', async () => {\n    const res = await request(app).get('/styles.css');\n    expect(res.status).toBe(200);\n    expect(res.type).toMatch(/css/);\n  });\n});\n"
    },
    {
      "path": "README.md",
      "contents": "# Express + Tailwind Hello World\n\nThis app serves a static index.html via Express and serves static assets from the public directory. Tailwind CSS is configured and compiles to public/styles.css.\n\n- Framework: Express\n- Styling: Tailwind CSS\n\n## Setup\n1. Install dependencies:\n   npm install\n\n2. Build CSS (optional initially, but recommended):\n   npm run build:css\n\n## Run (TypeScript entry)\n- Development with auto-reload:\n  npm run dev\n\n- Production build and start:\n  npm run build && npm start\n\n## Run (Plain JS entry)\nAlternatively, you can run the plain Node server:\n  npm run start:js\n\nThen open http://localhost:3000\n\n## Tests\nRun automated tests:\n  npm test\n\n## Notes\n- The root route (/) serves public/index.html.\n- Static files (e.g., /styles.css) are served from public/.\n- Tailwind CSS output is written to public/styles.css via npm run build:css.\n"
    }
  ],
  "notes": [
    "Use npm run dev for TS development or npm run start:js to run the plain JS server.",
    "Run npm run build:css to generate Tailwind CSS into public/styles.css."
  ],
  "hasTests": true
}