{
  "project_name": "truncate-middle",
  "files": [
    {
      "path": "package.json",
      "contents": "{\n  \"name\": \"truncate-middle\",\n  \"version\": \"0.1.0\",\n  \"type\": \"module\",\n  \"scripts\": {\n    \"test\": \"vitest\"\n  },\n  \"devDependencies\": {\n    \"typescript\": \"^5.2.0\",\n    \"vitest\": \"^1.0.0\"\n  }\n}\n"
    },
    {
      "path": "tsconfig.json",
      "contents": "{\n  \"compilerOptions\": {\n    \"target\": \"ES2019\",\n    \"module\": \"ESNext\",\n    \"moduleResolution\": \"NodeNext\",\n    \"declaration\": true,\n    \"outDir\": \"dist\",\n    \"strict\": true,\n    \"esModuleInterop\": true,\n    \"skipLibCheck\": true\n  },\n  \"include\": [\"src\", \"tests\"]\n}\n"
    },
    {
      "path": "README.md",
      "contents": "# truncate-middle\n\nA tiny TypeScript library providing a single function: truncateMiddle.\n\nWhat it does\n- Truncates a string by replacing the middle with an ellipsis (or custom marker) when the string is longer than a given maximum length.\n\nQuick start\n1. npm install\n2. npm test\n\nSee SPEC.md for the function specification and examples.\n"
    },
    {
      "path": "SPEC.md",
      "contents": "# Function specification: truncateMiddle\n\nPurpose\n- Provide a small, deterministic utility to truncate long strings by replacing their middle portion with an ellipsis (or a custom marker), preserving the start and end of the original string.\n\nFunction signature (TypeScript)\n\n- truncateMiddle(text: string, maxLength: number, options?: { ellipsis?: string }): string\n\nParameters\n- text: string — the input string to truncate.\n- maxLength: number — the maximum allowed length of the returned string. Must be a positive integer.\n- options.ellipsis?: string — optional replacement marker placed in the middle (default: single-character ellipsis \"…\").\n\nBehavior\n- If text.length <= maxLength, return text unchanged.\n- If maxLength is less than or equal to the length of the ellipsis, return the ellipsis truncated to maxLength characters.\n- Otherwise, allocate characters to keep from the start and end of the original string such that:\n  - total length = startChars + ellipsis.length + endChars = maxLength\n  - startChars = ceil((maxLength - ellipsis.length) / 2)\n  - endChars = floor((maxLength - ellipsis.length) / 2)\n  - Return: start + ellipsis + end\n\nValidation\n- text must be a string.\n- maxLength must be a finite integer >= 1.\n- options.ellipsis, if provided, must be a string.\n\nExamples\n- truncateMiddle('abcdefg', 5) -> 'ab…fg' (uses default ellipsis)\n- truncateMiddle('short', 10) -> 'short' (no truncation necessary)\n- truncateMiddle('1234567890', 3, { ellipsis: '...' }) -> '...'\n"
    },
    {
      "path": "src/index.ts",
      "contents": "export type TruncateOptions = { ellipsis?: string };\n\n/**\n * Truncate a string by replacing its middle with an ellipsis (or custom marker) so the result length <= maxLength.\n *\n * Rules (see SPEC.md):\n * - If text.length <= maxLength, return text unchanged.\n * - If maxLength <= ellipsis.length, return the ellipsis truncated to maxLength characters.\n * - Otherwise, preserve start and end of the text, placing the ellipsis between them. Start gets ceil(remaining/2)\n *   characters and end gets floor(remaining/2) characters so the total length equals maxLength.\n */\nexport function truncateMiddle(text: string, maxLength: number, options?: TruncateOptions): string {\n  const ellipsis = options?.ellipsis ?? \"…\"; // default single-character ellipsis\n\n  // Basic type validation\n  if (typeof text !== \"string\") {\n    throw new TypeError(\"text must be a string\");\n  }\n  if (typeof maxLength !== \"number\" || !Number.isFinite(maxLength) || !Number.isInteger(maxLength)) {\n    throw new TypeError(\"maxLength must be a finite integer\");\n  }\n  if (maxLength < 1) {\n    throw new RangeError(\"maxLength must be >= 1\");\n  }\n  if (typeof ellipsis !== \"string\") {\n    throw new TypeError(\"options.ellipsis must be a string\");\n  }\n\n  // If no truncation needed, return original string\n  if (text.length <= maxLength) {\n    return text;\n  }\n\n  // If the ellipsis itself is longer than or equal to maxLength, return a truncated ellipsis\n  if (ellipsis.length >= maxLength) {\n    return ellipsis.slice(0, maxLength);\n  }\n\n  // Number of characters we can keep from original text (excluding the ellipsis)\n  const charsToShow = maxLength - ellipsis.length;\n\n  // Split the visible characters between start and end\n  const frontChars = Math.ceil(charsToShow / 2);\n  const backChars = Math.floor(charsToShow / 2);\n\n  const start = text.slice(0, frontChars);\n  const end = text.slice(text.length - backChars);\n\n  return start + ellipsis + end;\n}\n"
    },
    {
      "path": "tests/index.test.ts",
      "contents": "import { describe, it, expect } from 'vitest';\nimport { truncateMiddle } from '../src/index';\n\ndescribe('truncateMiddle', () => {\n  it('returns the original text when shorter than maxLength', () => {\n    expect(truncateMiddle('short', 10)).toBe('short');\n  });\n\n  it('returns the original text when equal to maxLength', () => {\n    expect(truncateMiddle('equal', 5)).toBe('equal');\n  });\n\n  it('truncates with default ellipsis', () => {\n    // 'abcdefg' -> keep 2 at start, 2 at end with 1-char ellipsis -> 'ab…fg'\n    expect(truncateMiddle('abcdefg', 5)).toBe('ab…fg');\n  });\n\n  it('uses a custom ellipsis', () => {\n    expect(truncateMiddle('1234567890', 6, { ellipsis: '..' })).toBe('123..90');\n  });\n\n  it('returns truncated ellipsis when ellipsis is longer than maxLength', () => {\n    expect(truncateMiddle('longtext', 2, { ellipsis: '...' })).toBe('..');\n  });\n\n  it('throws for invalid types', () => {\n    // @ts-expect-error intentional misuse\n    expect(() => truncateMiddle((123 as unknown) as string, 5)).toThrow(TypeError);\n    // @ts-expect-error intentional misuse\n    expect(() => truncateMiddle('ok', NaN)).toThrow(TypeError);\n  });\n\n  it('throws for maxLength < 1', () => {\n    expect(() => truncateMiddle('ok', 0)).toThrow(RangeError);\n  });\n});\n"
    }
  ],
  "notes": [
    "Run tests with: npm test",
    "The implementation follows SPEC.md rules and includes validation and inline comments."
  ],
  "hasTests": true
}